key,indicator,label,ALB,BIH_STATE,BIH_RS,BIH_FBIH,KOS,MNE,MKD,SRB
TRANSPORT_I09,TRANSPORT_QL09,"The policy framework includes most (at least 3) of the following objectives: increasing the uptake of zero-emission vehicles and developing the relevant infrastructure (ex. electric vehicle charging points), reducing the emissions of key transport infrastructure hubs (ports, airports), making interurban and urban mobility more sustainable and healthier, greening freight transport and strengthening incentives for users and market participants to lower transport related emissions.",YES,YES,NO,YES,YES,YES,YES,YES
TRANSPORT_I09,TRANSPORT_QL09,The policy framework to make transport more environmentally sustainable includes all of the above-mentioned measures. ,NO,NO,NO,NO,NO,NO,NO,NO
TRANSPORT_I09,TRANSPORT_QL09,The EU Alternative Fuels Infrastructure Directive (Directive 2014/94/E) has been transposed and implemented. ,NO,NO,NO,NO,NO,NO,NO,NO
TRANSPORT_I09,TRANSPORT_QL09,"EU regulations on emissions reductions targets for new cars, vans and heavy-duty vehicles have been transposed and are being implemented. ",NO,NO,NO,NO,NO,NO,NO,NO
TRANSPORT_I09,TRANSPORT_QL09,Improving the resilience of the transport system and assessing its vulnerability to climate change are key objectives of transport policies and have been integrated into the relevant frameworks and legislation. ,YES,NO,NO,NO,YES,YES,YES,YES
TRANSPORT_I09,TRANSPORT_QL09,"A monitoring body to monitor the implementation of the action plan for improving road network resilience, developed by the Transport Community, has been established and is operational.",YES,NO,NO,NO,NO,NO,NO,NO
TRANSPORT_I09,TRANSPORT_QL09,"Data collection on the environmental sustainability of the transport sector is comprehensive and robust (ex. transport’s contributions to greenhouse gas emissions, average age of motorised vehicles, etc.) and data is being regularly updated. ",YES,NO,NO,NO,NO,NO,NO,YES
TRANSPORT_I09,TRANSPORT_QL09,Policies to make the transport sector more environmentally sustainable are regularly monitored and evaluated.,YES,NO,NO,NO,NO,NO,NO,YES
TRANSPORT_I09,TRANSPORT_QL09,Monitoring and evaluation results are informing the future design of policies for environmental sustainability in transport.,YES,NO,NO,NO,NO,NO,NO,YES
TRANSPORT_I10,TRANSPORT_QL10,"A road safety strategy has been adopted or policies to promote road safety exist, but there is no standalone road safety strategy or dedicated policy framework. 
*Under development ",YES*,YES*,YES*,YES*,YES,YES,YES,YES
TRANSPORT_I10,TRANSPORT_QL10,"The road safety strategy is aligned with the relevant EU acquis and includes a clear implementation plan, including timelines and budgets and clearly defines the roles and responsibilities of relevant bodies.",YES,NO,NO,NO,NO,YES,NO,YES
TRANSPORT_I10,TRANSPORT_QL10,"Transport policies contain some of the following objectives: improving accessibility to destinations, accessibility for users with specific needs; affordability or improving transport sector working conditions.",YES,NO,NO,NO,YES,YES,YES,YES
TRANSPORT_I10,TRANSPORT_QL10,A comprehensive policy framework has been developed to address all of the above objectives or these objectives are present across separate policy documents. ,NO,NO,YES,NO,NO,YES,NO,NO
TRANSPORT_I10,TRANSPORT_QL10,"Policies to ensure safety of all transport modes (in addition to road safety) existand are being implemented according to the implementation timeline(s). 
*For some transport modes",NO,NO,NO,NO,NO,YES*,YES,NO
TRANSPORT_I10,TRANSPORT_QL10,"The Regional Road Safety Action Plan, developed by the Transport Community is reflected in domestic strategies and is being implemented.",YES,NO,NO,NO,YES,YES,YES,YES
TRANSPORT_I10,TRANSPORT_QL10,"Data on transport safety is collected, regularly updated and comprehensive. 
*Only for road transport",YES*,NO,YES,NO,YES,YES,YES,YES
TRANSPORT_I10,TRANSPORT_QL10,The above-mentioned data is being collected for all transport modes. ,NO,NO,NO,NO,NO,NO,NO,NO
TRANSPORT_I10,TRANSPORT_QL10,Policy measures to make the transport system more just and inclusive are being implemented – advanced implementation of the related policy framework or individual policy initiatives.  ,YES,YES,YES,YES,YES,NO,NO,NO
TRANSPORT_I10,TRANSPORT_QL10,"Data on transport equity, ease of access and fairness of the transport system are being collected and regularly updated. ",NO,NO,NO,NO,NO,NO,NO,NO
TRANSPORT_I10,TRANSPORT_QL10,The Regional Road Safety Action Plan has been fully implemented and policies are being monitored and evaluated to further improve road safety.,NO,NO,NO,NO,NO,NO,NO,NO
TRANSPORT_I10,TRANSPORT_QL10,Evaluations of transport safety policies (including for modes other than road) are being used to improve future policies. ,YES,NO,NO,NO,YES,YES,NO,YES
TRANSPORT_I10,TRANSPORT_QL10,The EU road safety acquis has been fully transposed into national legislation.,NO,NO,NO,NO,NO,NO,NO,NO
TRANSPORT_I10,TRANSPORT_QL10,Evaluations of policies to make the transport system more just and fair are being used to improve future policies. ,NO,NO,NO,NO,NO,NO,NO,NO
ENERGY_I01,ENERGY_QL01,"An overarching policy framework establishing priorities for different energy policy areas (e.g. energy sustainability, energy security, energy markets, etc.) is in place. 
*Developed but not adopted",YES,YES,YES,YES,YES,YES,YES,YES*
ENERGY_I01,ENERGY_QL01,"Policies regarding the energy mix are based on the availability as well asl price of commodities, and take into account climate change impacts and mitigation goals. 
*Developed but not adopted",YES,YES,YES,YES,YES,YES,YES,YES*
ENERGY_I01,ENERGY_QL01,The legal and regulatory framework for the energy sector is moderately aligned with the EU and Energy Community acquis (at least 50% of the primary EU legislation has been transposed and the Energy Community has provided an implementation score of at least 60%),YES,NO,NO,YES,YES,YES,YES,YES
ENERGY_I01,ENERGY_QL01,"The main institutions for implementing the energy policy framework have been established, their responsibilities defined and there is good inter-institutional co-operation.",NO,NO,NO,NO,YES,NO,YES,YES
ENERGY_I01,ENERGY_QL01,"Information systems and databases of key energy indicators (ex. indicators on supply and demand, infrastructure and market operations) are updated and accessible to the wider public.",YES,YES,NO,YES,YES,NO,YES,YES
ENERGY_I01,ENERGY_QL01,At least half of the EU energy network codes have been transposed. ,YES,NO,NO,NO,NO,YES,YES,YES
ENERGY_I01,ENERGY_QL01,The legal and regulatory framework for the energy sector is well-aligned with the EU and Energy Community acquis (at least 75% of primary EU legislation and at least 50% of secondary legislation has been transposed and the Energy Community has provided an implementation score of at least 80%).,NO,NO,NO,NO,NO,NO,NO,NO
ENERGY_I01,ENERGY_QL01,All of the relevant EU energy network codes have been transposed.  ,NO,NO,NO,NO,NO,NO,NO,NO
ENERGY_I01,ENERGY_QL01,The progress in implementing the overarching energy policy framework is being regularly monitored. ,YES,YES,NO,NO,YES,YES,YES,NO
ENERGY_I01,ENERGY_QL01,The legal and regulatory framework for the energy sector is very well aligned with the EU and Energy Community acquis (at least 90% of primary EU legislation and at least 75% of secondary legislation has been transposed and the Energy Community has provided an implementation score of at least 90%).,NO,NO,NO,NO,NO,NO,NO,NO
ENERGY_I01,ENERGY_QL01,The energy policy framework is being evaluated and evaluation results are being used for the improvement of future policies.,NO,NO,NO,NO,YES,YES,YES,NO
ENERGY_I02,ENERGY_QL02,"The policy, legal, and institutional framework to establish an energy regulator is in place.",YES,YES,YES,YES,YES,YES,YES,YES
ENERGY_I02,ENERGY_QL02,An energy regulator has been established and is operational. ,YES,YES,YES,YES,YES,YES,YES,YES
ENERGY_I02,ENERGY_QL02,The legal framework establishing the energy regulator is compliant with the EU and Energy Community acquis ,YES,NO,NO,NO,YES,YES,YES,YES
ENERGY_I02,ENERGY_QL02,Mechanisms are in place to assure an effective co-ordination between the regulator and other relevant government bodies.,YES,NO,NO,NO,YES,YES,YES,YES
ENERGY_I02,ENERGY_QL02,The energy regulator’s activities are carried out transparently and regular reports on its functioning and its decisions are published timely and publicly available.,YES,YES,YES,YES,YES,YES,YES,YES
ENERGY_I02,ENERGY_QL02,"No infringement cases have been made (ex. within the framework of the Energy Community), related to the regulatory authority. ",YES,YES,YES,YES,YES,YES,YES,YES
ENERGY_I02,ENERGY_QL02,The energy regulator has adequate financial and human resources to fulfil its work plan and objectives. ,YES,YES,YES,YES,NO,NO,YES,NO
ENERGY_I02,ENERGY_QL02,The energy regulator’s staff have access to regular capacity building opportunities and salaries are competitive with comparable private sector positions.,YES,YES,YES,YES,NO,YES,YES,NO
ENERGY_I02,ENERGY_QL02,The regulator’s activity is regularly monitored based on inputs and outputs and results are evaluated based on the regulator’s objectives.,YES,NO,NO,NO,YES,YES,YES,YES
ENERGY_I02,ENERGY_QL02,"The regulatory authority actively participates, as an observer, in the work of the EU Agency for Co-operation of Energy Regulators. ",NO,NO,NO,NO,NO,YES,YES,NO
ENERGY_I02,ENERGY_QL02,"Salaries that the regulator pays its staff are above the industry level, allowing it to easily attract talent. ",NO,NO,NO,NO,NO,NO,NO,NO
ENERGY_I02,ENERGY_QL02,The regulator is politically and financially independent and has the power to launch ex officio investigations.,YES,NO,NO,NO,YES,YES,YES,YES
ENERGY_I03,ENERGY_QL03,"A policy framework to improve the resilience of the energy system to future shocks and disruptions (ex. climate change induced risks, external shocks) has been developed and adopted. ",YES,NO,NO,NO,YES,NO,YES,NO
ENERGY_I03,ENERGY_QL03,"Information systems and databases on key energy infrastructure indicators are created and updated regularly.
*Created but not updated regularly",YES,YES,YES,YES,YES*,NO,YES,YES
ENERGY_I03,ENERGY_QL03,A clear asset management methodology and system existto ensure the appropriate maintenance of energy infrastructure.,YES,NO,NO,NO,YES,NO,YES,YES
ENERGY_I03,ENERGY_QL03,The government has coherent and comprehensive demand and supply side emergency plans in the event of some form of unusual disruptions to the energy sector.,NO,NO,NO,NO,NO,NO,YES,NO
ENERGY_I03,ENERGY_QL03,International coordination mechanisms on crisis response co-ordination with neighbouring economies and international partners are in place.,NO,YES,YES,YES,NO,NO,YES,NO
ENERGY_I03,ENERGY_QL03,There is active co-operation in co-financing of energy infrastructure investment.,YES,NO,NO,YES,YES,YES,YES,YES
ENERGY_I03,ENERGY_QL03,"Data collection on key indicators related to the functioning of the electricity grid is robust, comprehensive and regularly updated.   ",YES,YES,YES,YES,NO,YES,YES,YES
ENERGY_I03,ENERGY_QL03,"Potential disruption scenarios and risks to the security of the energy system have been identified, and responses prepared. ",YES,NO,NO,NO,YES,NO,YES,YES
ENERGY_I03,ENERGY_QL03,Fast crisis reaction mechanisms and standing decision-making bodies are established. Institutional co-ordination mechanisms in case of disruption scenarios or external shocks to the energy system have been established. ,YES,NO,NO,NO,YES,NO,YES,YES
ENERGY_I03,ENERGY_QL03,The effectiveness and efficiency of measures taken under the crisis response mechanisms established is being evaluated and evaluations are used to inform future crisis response policies.,NO,NO,NO,NO,YES,NO,NO,NO
ENERGY_I03,ENERGY_QL03,"Regular evaluation activities assessing energy infrastructure investment policy and outcomes are conducted, informing future policy making.",YES,NO,NO,NO,YES,NO,NO,NO
ENERGY_I04,ENERGY_QL04,"A policy framework addressing diversification of energy supply is in place.
*Developed but not adopted",YES,YES,YES,YES,YES,NO,YES,YES*
ENERGY_I04,ENERGY_QL04,"The energy supply and diversification framework is robust and includes objectives to diversify several key fuels, including oil and gas, as well as sources of electricity generation. ",YES,NO,NOT_AVAILABLE,NOT_AVAILABLE,YES,NO,YES,NO
ENERGY_I04,ENERGY_QL04,Objectives related to gasification and gas penetration have been set and included in the energy supply framework.,YES,YES,YES,NO,NO,NO,YES,YES
ENERGY_I04,ENERGY_QL04,A clear objective to reduce reliance on key suppliers while improving the mix has been identified and is being executed.,YES,NO,NOT_AVAILABLE,NOT_AVAILABLE,NO,NO,YES,NO
ENERGY_I04,ENERGY_QL04,Renewable energy generation is considered in the policy framework for diversification.,YES,YES,YES,YES,YES,NO,YES,YES
ENERGY_I04,ENERGY_QL04,More than two gas traders and suppliers are active in the markets.,NO,YES,NOT_AVAILABLE,NOT_AVAILABLE,NO,NO,YES,YES
ENERGY_I04,ENERGY_QL04,More than 70% of gas imports are diversified away from a single source.,NO,NO,NOT_AVAILABLE,NOT_AVAILABLE,NO,NO,NO,NO
ENERGY_I04,ENERGY_QL04,The domestic electricity grid is connected to at least two neighbouring grids. ,YES,YES,NOT_AVAILABLE,NOT_AVAILABLE,YES,YES,YES,YES
ENERGY_I04,ENERGY_QL04,Information and data of key oil and gas supply indicators are being regularly updated and inform energy policy making. ,YES,NO,NO,NO,YES,YES,NO,NO
ENERGY_I04,ENERGY_QL04,More than five gas traders and suppliers are active in the markets.,NO,YES,NOT_AVAILABLE,NOT_AVAILABLE,NO,NO,NO,YES
ENERGY_I04,ENERGY_QL04,The domestic electricity grid is connected to at least three neighbouring grids. ,YES,YES,NOT_AVAILABLE,NOT_AVAILABLE,YES,YES,YES,YES
ENERGY_I04,ENERGY_QL04,Regular monitoring and evaluation activities assessing oil and gas supply policy and outcomes are conducted and results of monitoring and evaluation analysis are being used for the improvement of further diversification efforts.,YES,NO,NO,NO,NO,NO,YES,NO
ENERGY_I05,ENERGY_QL05,"A National Energy and Climate Plan (NECP), setting decarbonisation targets, in line with the EU Regulation on the Governance of the Energy Union and Climate Action, has been adopted.
*Developed but not adopted",YES,YES,NOT_AVAILABLE,NOT_AVAILABLE,YES*,NO,YES,YES*
ENERGY_I05,ENERGY_QL05,There is good institutional co-ordination between the different institutions responsible for achieving the greenhouse gas emission reduction targets under the NECP.,NO,YES,YES,YES,YES,NO,YES,YES
ENERGY_I05,ENERGY_QL05,"An inventory of greenhouse gas emissions of the energy sector has been conducted and is regularly updated.
*In place but not updated",YES*,YES,NOT_AVAILABLE,NOT_AVAILABLE,YES,YES,YES,YES
ENERGY_I05,ENERGY_QL05,A greenhouse gas pricing mechanism is in place.,NO,NO,NOT_AVAILABLE,NOT_AVAILABLE,NO,YES,NO,NO
ENERGY_I05,ENERGY_QL05,A national long-term strategy to steer decarbonisation efforts by 2050 with clear objectives has been drafted.,YES,NO,NOT_AVAILABLE,NOT_AVAILABLE,NO,NO,YES,YES
ENERGY_I05,ENERGY_QL05,A carbon neutrality target was set for 2050.,YES,NO,NOT_AVAILABLE,NOT_AVAILABLE,YES,NO,NO,NO
ENERGY_I05,ENERGY_QL05,"Regular monitoring and evaluation activities assessing the effectiveness of decarbonisation policy pathways are conducted.
*In place but not regularly monitored",YES*,YES,NO,YES,NO,NO,NO,YES
ENERGY_I05,ENERGY_QL05,A carbon neutrality target was set for 2040. ,NO,NO,NOT_AVAILABLE,NOT_AVAILABLE,NO,NO,NO,NO
ENERGY_I05,ENERGY_QL05,Prices of the greenhouse gas pricing mechanism are determined by market means only.,NO,NO,NOT_AVAILABLE,NOT_AVAILABLE,NO,NO,NO,NO
ENERGY_I05,ENERGY_QL05,Results of monitoring and evaluation analysis inform updates to the decarbonisation policy framework.,NO,NO,NO,NO,NO,NO,NO,NO
ENERGY_I06,ENERGY_QL06,A National Renewable Action Plan or equivalent policy framework for encouraging the development of renewable energy sources has been adopted.,YES,YES,YES,YES,YES,YES,YES,YES
ENERGY_I06,ENERGY_QL06,Competitive mechanisms such as capacity auctions are in place for new renewable energy projects,YES,NOT_AVAILABLE,YES,YES,YES,YES,YES,YES
ENERGY_I06,ENERGY_QL06,The legal framework for renewable energy is largely compliant with the requirements from the EU and Energy Community acquis.,YES,YES,YES,YES,YES,NO,YES,YES
ENERGY_I06,ENERGY_QL06,All renewable energy support schemes are designed to have a minimal market distorting effect while supporting renewable generation.,NO,NO,NO,NO,YES,YES,NO,YES
ENERGY_I06,ENERGY_QL06,The policy framework acknowledges and encourages the development of decentralised renewable generation and the role of prosumers. ,YES,YES,YES,YES,YES,NO,YES,YES
ENERGY_I06,ENERGY_QL06,Information and data on key renewable energy indicators is regularly updated and accessible to the wider public.,YES,YES,NO,NO,YES,NO,YES,YES
ENERGY_I06,ENERGY_QL06,The legal framework for renewable energy is fully compliant with the requirements from the EU and Energy Community acquis.,NO,NO,NO,NO,NO,NO,NO,NO
ENERGY_I06,ENERGY_QL06,The implementation of the policy framework is advancing – at least 50% of planned activities have been implemented on schedule. ,YES,NO,NO,NO,YES,NO,NO,NO
ENERGY_I06,ENERGY_QL06,Regular monitoring and evaluation activities assessing the effectiveness of renewable energy policy are conducted.,YES,NO,NO,NO,YES,YES,YES,NO
ENERGY_I06,ENERGY_QL06,Results of monitoring and evaluation analysis are being used for the improvement of future renewable energy policies.,YES,NO,NO,NO,YES,NO,YES,NO
ENERGY_I07,ENERGY_QL07,"A policy framework with the goal of improving energy efficiency is in place.
*Targets are not aligned with the Energy Community acquis
",YES,YES,YES,YES,YES,YES*,YES,YES
ENERGY_I07,ENERGY_QL07,The primary legal framework for energy efficiency is adopted and compliant with the requirements of the EU and Energy Community acquis.,YES,NO,NO,NO,NO,YES,YES,YES
ENERGY_I07,ENERGY_QL07,Adequate financial support schemes supporting investment in energy efficiency and energy saving measures are in place.,YES,NO,NO,NO,YES,YES,YES,YES
ENERGY_I07,ENERGY_QL07,A significant share of secondary legislation (by-laws) related to energy efficiency has been transposed and aligned with the EU and Energy Community acquis.,YES,NOT_AVAILABLE,YES,YES,NO,YES,NO,YES
ENERGY_I07,ENERGY_QL07,Programmes (voluntary or obligatory) promoting the uptake of energy efficiency and energy saving measures are in place.,YES,NOT_AVAILABLE,YES,YES,YES,YES,NO,YES
ENERGY_I07,ENERGY_QL07,"Information and data on key energy efficiency indicators are collected, regularly updated and accessible to the wider public.",NO,YES,NO,YES,YES,YES,YES,YES
ENERGY_I07,ENERGY_QL07,Implementation of the energy efficiency policy framework is advancing -  at least 50% of planned activities have been implemented on schedule.,YES,NO,NO,NO,YES,YES,YES,NO
ENERGY_I07,ENERGY_QL07,All required Energy Efficiency by-laws have been transposed and are implemented.,NO,NO,NO,NO,NO,NO,NO,NO
ENERGY_I07,ENERGY_QL07,"Regular monitoring and evaluation activities assessing energy efficiency policy, legal and institutional outcomes are conducted.",NO,NO,NO,NO,YES,YES,YES,NO
ENERGY_I07,ENERGY_QL07,Results of monitoring and evaluation analysis are being used for the improvement of future energy efficiency policies.,NO,NO,NO,NO,YES,YES,YES,NO
ENERGY_I08,ENERGY_QL08,A definition of energy poverty and vulnerable consumers exists in policy documents and / or legislation.,YES,NO,NO,NO,YES,NO,NO,YES
ENERGY_I08,ENERGY_QL08,A policy framework addressing energy poverty is in place.,YES,NO,NO,NO,YES,NO,YES,YES
ENERGY_I08,ENERGY_QL08,Support schemes for vulnerable consumers are in place. ,YES,NO,YES,YES,YES,YES,YES,YES
ENERGY_I08,ENERGY_QL08,"In addition to supporting vulnerable consumers in the short term, the policy framework takes into account long-term solutions to energy poverty.",NO,NO,NO,NO,NO,NO,YES,NO
ENERGY_I08,ENERGY_QL08,An inventory of all support mechanisms is made which aims to avoid duplication in support and adverse redistributive effects. ,YES,NO,NO,NO,YES,YES,NO,YES
ENERGY_I08,ENERGY_QL08,A comprehensive set of data relevant for targeting of support schemes for vulnerable consumers is collected and regularly updated.,NO,NO,NO,NO,NO,NO,YES,NO
ENERGY_I08,ENERGY_QL08,A support scheme targeting energy poverty with price regulation of energy is implemented.,NO,NO,NO,NO,NO,NO,YES,YES
ENERGY_I08,ENERGY_QL08,A support scheme targeting energy poverty without price regulation of consumed energy is implemented.,YES,NO,YES,YES,YES,YES,YES,YES
ENERGY_I08,ENERGY_QL08,"Regular monitoring and evaluation activities assessing energy poverty policy, economic and social outcomes are conducted.",NO,NO,NO,NO,NO,NO,NO,NO
ENERGY_I08,ENERGY_QL08,Results of monitoring and evaluation analysis are being used for the improvement of future energy poverty policies.,NO,NO,NO,NO,NO,NO,NO,NO
ENERGY_I09,ENERGY_QL09,"A policy, legal and/or institutional framework addressing energy market operations is in place.",YES,NO,YES,YES,YES,YES,YES,YES
ENERGY_I09,ENERGY_QL09,The framework defines independent market operator requirements and sets out criteria and procedures for licensing and the designation of nominated market operators. ,YES,NO,NO,NO,YES,YES,YES,YES
ENERGY_I09,ENERGY_QL09,The legal framework is fully compliant with the requirements of the Third Energy and the Clean Energy Package.,NO,NO,NO,NO,NO,NO,NO,NO
ENERGY_I09,ENERGY_QL09," Market operators for the operation of organised energy markets are established and market participation requirements are published.
*Not fully established",YES,NO,NO,NO,YES,YES*,YES,YES
ENERGY_I09,ENERGY_QL09,"Markets are continuously monitored, assessed, and adjusted if a barrier to market entry is identified. ",YES,NO,NO,NO,YES,YES,YES,YES
ENERGY_I09,ENERGY_QL09,"Market participation requirements are not discriminatory, excessively burdensome and do not require a seat in the respective jurisdiction.",NO,NO,NO,NO,NO,YES,YES,YES
ENERGY_I09,ENERGY_QL09,Market operators for cross-border market integration are designated according to EU and Energy Community requirements.,YES,NO,NO,NO,YES,NO,YES,YES
ENERGY_I09,ENERGY_QL09,Information and data on key market operations indicators is regularly updated and accessible to the wider public.,NO,NO,NO,NO,NO,YES,YES,YES
ENERGY_I09,ENERGY_QL09,"The EU Transparency Regulation (No 543/2013) is fully transposed and implemented, and electricity market data is regularly submitted to the central data platform established by the European Network of Transmission System Operators for Electricity (ENTSO-E).",YES,NO,NO,NO,YES,YES,YES,YES
ENERGY_I09,ENERGY_QL09,Markets are competitive and are operating with minimal government distorting impact.,NO,NO,NO,NO,NO,YES,NO,NO
ENERGY_I09,ENERGY_QL09,More than 30% of gross inland electricity consumption is traded within the electricity markets.,YES,NO,NO,NO,YES,NO,NO,NO
ENERGY_I09,ENERGY_QL09,The EU target market operations model is fully implemented.,NO,NO,NO,NO,NO,NO,NO,YES
ENERGY_I10,ENERGY_QL10,A policy framework addressing unbundling and third-party access is in place.,YES,NO,YES,YES,YES,YES,YES,YES
ENERGY_I10,ENERGY_QL10,An adequate legal framework is adopted and is fully compliant with the requirements of the Third Energy Package.,YES,NO,NO,NO,YES,YES,YES,YES
ENERGY_I10,ENERGY_QL10,"Third party access rules, technical requirements, and costs for all grid levels have been published.",YES,NO,NO,YES,YES,YES,YES,YES
ENERGY_I10,ENERGY_QL10,Trade licenses are mutually recognised within the Energy Community.,NO,NO,NO,NO,NO,NO,NO,YES
ENERGY_I10,ENERGY_QL10,Third party access tariffs are based on cost recovery principles and are not used for refinancing of other elements or institutions.,YES,NO,NO,NO,YES,YES,YES,YES
ENERGY_I10,ENERGY_QL10,Information and data on key unbundling and third-party access indicators is regularly updated and accessible to the wider public.,YES,NO,NO,NO,YES,YES,YES,NO
ENERGY_I10,ENERGY_QL10,Gas and electricity transmission and distribution system operators are unbundled and are accommodating third party access to relevant infrastructure.,YES,NO,NO,NO,YES,YES,NO,NO
ENERGY_I10,ENERGY_QL10,Nearly all (90% or more) third-party access requests are processed within three months.,YES,NO,YES,NO,YES,YES,YES,YES
ENERGY_I10,ENERGY_QL10,"The energy sector is fully unbundled with diverse users and infrastructure, and third-party access is allowed to all energy companies.",YES,NO,NO,NO,YES,YES,NO,NO
ENERGY_I10,ENERGY_QL10,Regular monitoring and evaluation activities assessing unbundling and third-party access outcomes are conducted. Results of monitoring and evaluation analysis are being used for the improvement of future unbundling and third party access policies.,YES,NO,NO,NO,YES,YES,NO,NO
ENERGY_I11,ENERGY_QL11,A policy framework addressing interconnection congestion and reliability management as well as harmonisation of market rules on a regional level is in place.,YES,YES,NOT_AVAILABLE,NOT_AVAILABLE,YES,YES,YES,YES
ENERGY_I11,ENERGY_QL11,An adequate legal framework on interconnection congestion and reliability management as well as harmonisation of market rules on a regional level has been adopted.,YES,YES,NOT_AVAILABLE,NOT_AVAILABLE,YES,YES,NO,NO
ENERGY_I11,ENERGY_QL11,"The government actively co-operates with other governments in the region to advance regional market integration (ex. by signing memorandums of understanding, by undertaking joint infrastructure projects, etc.). ",YES,NO,NOT_AVAILABLE,NOT_AVAILABLE,YES,YES,YES,NO
ENERGY_I11,ENERGY_QL11,Institutional co-ordination mechanisms at the regional level for cross-border market integration are in place. ,YES,NO,NOT_AVAILABLE,NOT_AVAILABLE,YES,YES,YES,YES
