key,indicator,label,ALB,BIH_STATE,BIH_RS,BIH_FBIH,KOS,MNE,MKD,SRB
INVESTMENT_I01,INVESTMENT_QL01,"There is a separate and transparent regulatory framework for investment in place. 
*Not yet adopted but under development. ",YES*,YES,YES,YES,YES,YES,YES,YES
INVESTMENT_I01,INVESTMENT_QL01,"There are adequate provisions against expropriation, which have clear definitions and criteria. ",YES,YES,YES,YES,YES,YES,YES,YES
INVESTMENT_I01,INVESTMENT_QL01,"A legal framework for private-public partnerships exists. 
*Not yet adopted but under development ",YES,NO,YES,YES*,YES,YES,YES,YES
INVESTMENT_I01,INVESTMENT_QL01,Due compensation is calculated on an appropriate legal basis. ,YES,NO,YES,YES,YES,YES,YES,YES
INVESTMENT_I01,INVESTMENT_QL01,Investors can easily access information on laws and regulations governing investment.    ,YES,YES,YES,YES,YES,YES,YES,YES
INVESTMENT_I01,INVESTMENT_QL01,There are provisions for strategic investment in place.,YES,NO,YES,YES,YES,NO,YES,YES
INVESTMENT_I01,INVESTMENT_QL01,The laws governing investment are regularly subject to public consultations and feedback from the business community.,YES,YES,YES,YES,YES,YES,YES,YES
INVESTMENT_I01,INVESTMENT_QL01,expropriation orders are carefully reviewed by an independent authority.  ,YES,NO,YES,YES,NO,NO,NO,YES
INVESTMENT_I01,INVESTMENT_QL01,There is a competitive tendering process in place for public-private projects. ,YES,NOT_AVAILABLE,YES,NO,YES,YES,NO,YES
INVESTMENT_I01,INVESTMENT_QL01,Land acquisitions over a certain threshold are subject to ex ante and ex post social and environmental assessments.,YES,NOT_AVAILABLE,NO,NO,YES,YES,NO,YES
INVESTMENT_I01,INVESTMENT_QL01,Laws are adjusted based on stakeholder consultation.,YES,YES,YES,YES,NO,YES,YES,NO
INVESTMENT_I01,INVESTMENT_QL01,Potential expropriations are subject to due process and ensure public interest motivation and fair market compensation. ,YES,NO,YES,YES,YES,YES,YES,YES
INVESTMENT_I02,INVESTMENT_QL02,Investors have access to a commercial or investment arbitration.  ,YES,YES,NOT_AVAILABLE,NOT_AVAILABLE,YES,YES,YES,YES
INVESTMENT_I02,INVESTMENT_QL02,New York Convention and the International Centre for Settlement of Investment Disputes Convention have been ratified.,YES,YES,NOT_AVAILABLE,NOT_AVAILABLE,YES,YES,YES,YES
INVESTMENT_I02,INVESTMENT_QL02,Conditions of validity and enforcement of foreign judgments are recognized by national laws. ,YES,YES,YES,YES,YES,YES,YES,YES
INVESTMENT_I02,INVESTMENT_QL02,Foreign arbitral awards are generally recognised and enforced by local courts. ,YES,YES,YES,YES,YES,YES,YES,YES
INVESTMENT_I02,INVESTMENT_QL02,Investment-state disputes are resolved under investment treaties. ,YES,YES,NOT_AVAILABLE,NOT_AVAILABLE,YES,YES,YES,YES
INVESTMENT_I02,INVESTMENT_QL02,"There are mechanisms in place that aim to avoid disputes, such as ombudsman services or mediation.  ",YES,YES,YES,YES,YES,YES,YES,YES
INVESTMENT_I02,INVESTMENT_QL02,The experience with investment disputes under investment treaties is thoroughly evaluated.,NO,YES,NOT_AVAILABLE,NOT_AVAILABLE,NO,YES,YES,NO
INVESTMENT_I02,INVESTMENT_QL02,The implications of international investment treaties are widely communicated to respective government agencies.   ,NO,YES,NOT_AVAILABLE,NOT_AVAILABLE,NO,NO,NO,YES
INVESTMENT_I03,INVESTMENT_QL03,"Legislation on intellectual property is in place and is consistent with WIPO and WTO agreements. 
*Not yet adopted but under development",YES,YES*,NOT_AVAILABLE,NOT_AVAILABLE,YES,YES,YES,YES
INVESTMENT_I03,INVESTMENT_QL03,"Intellectual property rights legislation protects trademarks, patents, industrial designs, geographical indications and copyrights. ",YES,YES,NOT_AVAILABLE,NOT_AVAILABLE,YES,YES,YES,YES
INVESTMENT_I03,INVESTMENT_QL03,There is a website or other basic information channel raising awareness about intellectual property rights. ,YES,YES,NOT_AVAILABLE,NOT_AVAILABLE,YES,YES,YES,YES
INVESTMENT_I03,INVESTMENT_QL03,"Criminal procedures exist for cases of counterfeiting, piracy, patent infringement. ",YES,YES,NOT_AVAILABLE,NOT_AVAILABLE,YES,YES,YES,YES
INVESTMENT_I03,INVESTMENT_QL03,"There is an intellectual property enforcement body established. 
*Partly
",YES,YES,NOT_AVAILABLE,NOT_AVAILABLE,YES,YES,YES*,YES
INVESTMENT_I03,INVESTMENT_QL03,The intellectual property body has the regulatory power to govern and give judgements in intellectual property-related disputes.,YES,NO,NOT_AVAILABLE,NOT_AVAILABLE,NO,NO,YES,NO
INVESTMENT_I03,INVESTMENT_QL03,The government organises awareness-raising and information sessions on how to use the IP system within the economy. ,YES,YES,NOT_AVAILABLE,NOT_AVAILABLE,YES,YES,YES,YES
INVESTMENT_I03,INVESTMENT_QL03,The intellectual property laws are subject to regular monitoring and evaluation. ,NO,NO,NOT_AVAILABLE,NOT_AVAILABLE,NO,NO,NO,YES
INVESTMENT_I03,INVESTMENT_QL03,The government proactively raises awareness on intellectual property rights and infringement through seminars and public campaigns targeting civil society and the private sector. ,YES,NO,NOT_AVAILABLE,NOT_AVAILABLE,NO,NO,YES,YES
INVESTMENT_I03,INVESTMENT_QL03,The government provides active support in obtaining and filing for intellectual protection and implemented policies to reduce the cost of related processes. ,YES,YES,NOT_AVAILABLE,NOT_AVAILABLE,YES,YES,NO,YES
INVESTMENT_I03,INVESTMENT_QL03,"The information and data from all available information sources is communicated in a user-friendly, accessible database. ",YES,NO,NOT_AVAILABLE,NOT_AVAILABLE,NO,NO,NO,YES
INVESTMENT_I03,INVESTMENT_QL03,Relevant officials and enforcement bodies receive specialised training to properly enforce IP laws.,YES,NO,NOT_AVAILABLE,NOT_AVAILABLE,NO,NO,YES,YES
INVESTMENT_I04,INVESTMENT_QL04,There is a dedicated investment promotion agency in the economy.,YES,YES,NOT_AVAILABLE,NOT_AVAILABLE,YES,YES,YES,YES
INVESTMENT_I04,INVESTMENT_QL04,Investor targeting is undertaken in an ad-hoc manner. ,YES,NO,NO,NO,YES,YES,YES,NO
INVESTMENT_I04,INVESTMENT_QL04,There is a coherent and clear investment promotion strategy.,YES,NO,YES,YES,YES,YES,YES,YES
INVESTMENT_I04,INVESTMENT_QL04,"The investment promotion agency, or relevant body, uses user/client satisfaction surveys to measure its impact. ",YES,YES,NOT_AVAILABLE,NOT_AVAILABLE,NO,NO,YES,YES
INVESTMENT_I04,INVESTMENT_QL04,There are formal mechanisms in place to foster FDI linkages within the economy. ,YES,YES,YES,YES,NO,YES,YES,YES
INVESTMENT_I04,INVESTMENT_QL04,There is a formal coordination mechanism between relevant investment promotion bodies.   ,YES,YES,YES,YES,YES,YES,YES,YES
INVESTMENT_I04,INVESTMENT_QL04,Investor targeting activities are consistent and accompanied by adequate follow-up and analysis. ,YES,YES,YES,YES,NO,YES,NO,YES
INVESTMENT_I04,INVESTMENT_QL04,"The work of the investment promotion agency, or relevant body is monitored by an independent agency. ",NO,YES,NOT_AVAILABLE,NOT_AVAILABLE,YES,NO,NO,YES
INVESTMENT_I04,INVESTMENT_QL04,Annual performance results undergo public auditing procedures and are available to the broader public.,YES,NO,NOT_AVAILABLE,NOT_AVAILABLE,NO,NO,NO,YES
INVESTMENT_I04,INVESTMENT_QL04,There is a mechanism in place to maximise FDI spillovers. ,YES,NO,NO,NO,NO,NO,NO,NO
INVESTMENT_I04,INVESTMENT_QL04,Sustainability objectives are fully integrated into the operational strategy of the investment promotion agency or relevant body. ,NO,NO,NO,NO,NO,NO,NO,YES
INVESTMENT_I05,INVESTMENT_QL05,"The investment promotion agency, or relevant body, regularly provide investment facilitation services. ",YES,YES,NOT_AVAILABLE,NOT_AVAILABLE,YES,YES,YES,YES
INVESTMENT_I05,INVESTMENT_QL05,The investment promotion agency occasionally takes action to streamline registration procedures and reduce unnecessary paperwork. ,YES,NO,NO,NO,YES,YES,YES,YES
INVESTMENT_I05,INVESTMENT_QL05,Formal co-ordination mechanism is in place to adequately disseminate information and integrate investor feedback into future policies.,YES,YES,NOT_AVAILABLE,NOT_AVAILABLE,YES,YES,YES,YES
INVESTMENT_I05,INVESTMENT_QL05,“Silence is consent” clause exists. ,YES,NO,NO,NO,YES,NO,NO,NO
INVESTMENT_I05,INVESTMENT_QL05,"The investment promotion agency, or relevant body is consistently implementing measures to simplify the business registration process. ",NO,YES,NOT_AVAILABLE,NOT_AVAILABLE,YES,YES,YES,NO
INVESTMENT_I05,INVESTMENT_QL05,"The investment promotion agency, or relevant body, is systematically consulted on matters affecting investment policy in the economy. ",YES,YES,NOT_AVAILABLE,NOT_AVAILABLE,YES,YES,YES,YES
INVESTMENT_I05,INVESTMENT_QL05,"The investment promotion agency, or relevant body, is responsible for providing at least 80% of regulatory approvals and registration procedures to establish a business in the host economy.",YES,NO,NOT_AVAILABLE,NOT_AVAILABLE,YES,NO,NO,NO
INVESTMENT_I05,INVESTMENT_QL05,A business can be fully established electronically. ,YES,NO,NO,NO,YES,YES,YES,YES
INVESTMENT_I05,INVESTMENT_QL05,"The investment promotion agency, or relevant body, is engaged in policy advocacy and dialogue, which translates into future policy design.",YES,NO,NOT_AVAILABLE,NOT_AVAILABLE,NO,YES,YES,YES
INVESTMENT_I05,INVESTMENT_QL05,"The investment promotion agency, or relevant body, regularly provide aftercare services.",YES,YES,NOT_AVAILABLE,NOT_AVAILABLE,NO,YES,YES,YES
INVESTMENT_I05,INVESTMENT_QL05,There is high-level political commitment to public-private sector dialogues.,NO,NO,NO,NO,NO,NO,YES,YES
INVESTMENT_I06,INVESTMENT_QL06,"The investment promotion agency, or relevant body regulalrly provides investor incentives, with limited oversight. ",YES,YES,NOT_AVAILABLE,NOT_AVAILABLE,YES,YES,YES,YES
INVESTMENT_I06,INVESTMENT_QL06,"Investor incentives are provided following a cost-benefit analysis, although the results are not available to the public. ",YES,NO,NO,NO,NO,YES,NO,YES
INVESTMENT_I06,INVESTMENT_QL06,There are sunset clauses in place. ,NO,NO,NO,NO,NO,YES,YES,YES
INVESTMENT_I06,INVESTMENT_QL06,"Procedures and criteria for granting investor incentives are clear and transparent, although with a degree of limitation.",YES,NO,YES,NO,YES,YES,YES,YES
INVESTMENT_I06,INVESTMENT_QL06,"The investment promotion agency, or relevant body, conducts ad hoc monitoring of investors’ obligations. ",YES,YES,YES,YES,NO,YES,YES,YES
INVESTMENT_I06,INVESTMENT_QL06,"Investor incentives are regularly subject to a cost-benefit analysis, the results of which are available to the public. ",NO,NO,NO,NO,NO,NO,YES,NO
INVESTMENT_I06,INVESTMENT_QL06,Renewal of investor incentives is granted with appropriate scrutiny.  ,NO,NO,NO,NO,NO,YES,YES,YES
INVESTMENT_I06,INVESTMENT_QL06,Cost-Benefit analysis takes into account social and environmental impact of incentives-motivated investment. ,YES,NO,NO,NO,NO,YES,NO,YES
INVESTMENT_I06,INVESTMENT_QL06,Investor incentives are regulated by the tax code of the economy. ,YES,NO,YES,YES,YES,NO,YES,YES
INVESTMENT_I06,INVESTMENT_QL06,Incentives are assessed against potential for aggressive tax planning by investors.,NO,NO,NO,NO,NO,NO,NO,YES
INVESTMENT_I07,INVESTMENT_QL07,"There is a strategic policy framework governing sustainable investment. 
*Law has been adopted but is still pending approval",YES,NO,YES,YES,YES*,YES,NO,YES
INVESTMENT_I07,INVESTMENT_QL07,"Other sustainability strategies take investment into account on an ad hoc basis. 
",YES,YES,YES,YES,YES,YES,YES,YES
INVESTMENT_I07,INVESTMENT_QL07,"The national strategic policy framework for sustainable investment addresses investment-related objectives linked to the Sustainable Development Goals  
",YES,NO,YES,NO,YES,YES,NO,YES
INVESTMENT_I07,INVESTMENT_QL07,Implementation responsibilities are clearly defined between national and sub-national institutions. ,NO,NO,NO,NO,NO,YES,NO,NO
INVESTMENT_I07,INVESTMENT_QL07,"Formal coordination mechanisms with non-government stakeholders, including the private sector and civil society are in place.",YES,YES,YES,YES,YES,YES,NO,YES
INVESTMENT_I07,INVESTMENT_QL07,National sustainability strategies are aligned with international standards and commitments.  ,YES,NO,YES,YES,YES,YES,NO,YES
INVESTMENT_I07,INVESTMENT_QL07,"Clear environmental, social, and corporate governance criteria have been established. ",NO,NO,NO,NO,YES,NO,NO,YES
INVESTMENT_I07,INVESTMENT_QL07,The national strategic framework has been subject to a data and evidence driven evaluation and has been adjusted accordingly.   ,NO,NO,NO,YES,NO,NO,NO,YES
INVESTMENT_I07,INVESTMENT_QL07,There is an inter-institutional co-ordination mechanism in place at the sub-national level. ,NO,YES,YES,YES,YES,NO,NO,YES
INVESTMENT_I07,INVESTMENT_QL07,Sustainability objectives are integrated into trade and investment agreements. ,NO,NO,NO,NO,NO,YES,NO,NO
INVESTMENT_I08,INVESTMENT_QL08,There are financial and technical supports in place for sustainable investment. ,YES,NO,YES,NO,YES,YES,YES,YES
INVESTMENT_I08,INVESTMENT_QL08,Financial and technical supports for sustainable investment are funded through non-donor funded national resources. ,YES,NO,YES,NO,YES,YES,YES,NO
INVESTMENT_I08,INVESTMENT_QL08,Financial and technical supports for sustainable investment contain sunset clauses or other time limitation mechanisms. ,YES,NO,NO,NO,NO,YES,YES,YES
INVESTMENT_I08,INVESTMENT_QL08,"The government conducts regular cost and benefits analysis of the supports considering environmental and social aspects, although the results are not available to the public. ",YES,NO,YES,NO,YES,NO,YES,YES
INVESTMENT_I08,INVESTMENT_QL08,Financial and technical supports for sustainable investment address market failures linked to sustainable investment aspects of the Sustainable Development Goals. ,NO,NO,YES,NO,YES,YES,YES,YES
INVESTMENT_I08,INVESTMENT_QL08,There is consistent and regular monitoring of the recipients’ compliance with eligibility criteria and related obligations. ,NO,NO,NO,NO,YES,YES,YES,YES
INVESTMENT_I08,INVESTMENT_QL08,The duration of financial and technical supports takes into account the maturity of the market. ,NO,NO,NO,NO,YES,NO,NO,YES
INVESTMENT_I08,INVESTMENT_QL08,The results of the cost-benefit analysis are publicly available.    ,NO,NO,NO,NO,YES,NO,YES,YES
INVESTMENT_I08,INVESTMENT_QL08,Financial or technical supports for sustainable investment are adjusted based on monitoring and evaluation results. ,NO,NO,NO,NO,NO,NO,NO,NO
INVESTMENT_I08,INVESTMENT_QL08,"Renewal of technical and financial supports is possible after appropriate scrutiny and parliamentary oversight, ",NO,NO,NO,NO,NO,NO,NO,NO
INVESTMENT_I08,INVESTMENT_QL08,Supports have been subject to independent impact assessments. ,NO,NO,NO,NO,NO,NO,NO,YES
INVESTMENT_I08,INVESTMENT_QL08,"Financial and technical supports for sustainable investment are transparent and subject to regular reviews, monitoring and evaluation. ",NO,NO,NO,NO,YES,NO,YES,YES
TRADE_I01,TRADE_QL01,There is one dedicated Ministry in charge of overseeing trade policy formulation. ,YES,YES,NOT_AVAILABLE,NOT_AVAILABLE,YES,YES,YES,YES
TRADE_I01,TRADE_QL01,The Ministry in charge of trade holds consultations on trade policy with only a few of the relevant ministries or agencies. ,YES,YES,NOT_AVAILABLE,NOT_AVAILABLE,YES,YES,YES,YES
TRADE_I01,TRADE_QL01,There is a formal inter-ministerial consultation mechanism in place for trade policy formulation. ,YES,YES,NOT_AVAILABLE,NOT_AVAILABLE,YES,YES,YES,YES
TRADE_I01,TRADE_QL01,Inter-ministerial consultations are conducted at all stages of policymaking. ,YES,YES,NOT_AVAILABLE,NOT_AVAILABLE,YES,YES,YES,YES
TRADE_I01,TRADE_QL01,The results of inter-ministerial consultations are translated into future policy initiatives. ,NO,YES,NOT_AVAILABLE,NOT_AVAILABLE,YES,YES,NO,YES
TRADE_I01,TRADE_QL01,Stakeholders’ consultations are conducted at all stages of policymaking. ,YES,YES,NOT_AVAILABLE,NOT_AVAILABLE,YES,YES,YES,YES
TRADE_I01,TRADE_QL01,Trade policy is designed to have concrete goals to improve trade performance. ,YES,YES,NOT_AVAILABLE,NOT_AVAILABLE,YES,YES,YES,YES
TRADE_I01,TRADE_QL01,The coordination mechanism for trade policy formulation is consistently monitored and evaluated. ,YES,YES,NOT_AVAILABLE,NOT_AVAILABLE,YES,YES,YES,YES
TRADE_I01,TRADE_QL01,The evaluation results are considered in future policy design.   ,YES,YES,NOT_AVAILABLE,NOT_AVAILABLE,YES,YES,NO,YES
TRADE_I01,TRADE_QL01,Trade policy considers environmental objectives aligned with relevant national environmental targets. ,YES,YES,NOT_AVAILABLE,NOT_AVAILABLE,YES,YES,YES,NO
TRADE_I01,TRADE_QL01,Relevant ministries participate in exchanges of good practices on integrating environmental objectives into trade policy through international bodies.,YES,NO,NOT_AVAILABLE,NOT_AVAILABLE,NO,YES,YES,YES
TRADE_I01,TRADE_QL01,Data on environmental aspects of trade are regularly collected. ,NO,NO,NOT_AVAILABLE,NOT_AVAILABLE,NO,NO,NO,YES
TRADE_I02,TRADE_QL02,The government has adopted relevant legislation or guidelines governing public-private consultations. ,YES,YES,YES,YES,YES,YES,YES,YES
TRADE_I02,TRADE_QL02,There is a prior public notice and comments procedure in place for trade policy measures.  ,YES,YES,YES,YES,YES,YES,YES,YES
TRADE_I02,TRADE_QL02,Formal public-private consultations occur on a regular basis.  ,YES,YES,YES,YES,YES,YES,YES,YES
TRADE_I02,TRADE_QL02,The government publishes trade measures on a publicly accessible digital platform. ,YES,YES,YES,YES,YES,YES,YES,YES
TRADE_I02,TRADE_QL02,"The Ministry in charge of trade publishes timelines, goals and the scope of consultations in advance through digital means.   ",YES,YES,YES,YES,YES,YES,NO,YES
TRADE_I02,TRADE_QL02,"Analysis, impact assessment results and reasoning behind regulatory decisions and other relevant material, is publicly available. ",YES,YES,NO,YES,YES,YES,YES,YES
TRADE_I02,TRADE_QL02,A permanent advisory body has been established including a wide array of stakeholders. ,YES,NO,NO,NO,YES,YES,NO,YES
TRADE_I02,TRADE_QL02,Public-private consultation mechanism is regularly evaluated to ensure transparency and objectivity. ,YES,NO,NO,YES,YES,NO,YES,YES
TRADE_I02,TRADE_QL02,Consultations regarding trade measures are open and mandatory to all affected groups and aim to measure the policies’ impact and cost-effectiveness.,YES,NO,YES,YES,YES,YES,NO,YES
TRADE_I02,TRADE_QL02,All comments on draft legislation receive timely feedback. ,YES,YES,YES,YES,NO,YES,YES,YES
TRADE_I02,TRADE_QL02,Environmental stakeholders are included in public-private consultations.,YES,YES,NO,NO,YES,NO,NO,NO
TRADE_I03,TRADE_QL03,There is dedicated digital trade law in place. ,YES,YES,YES,NO,YES,YES,YES,YES
TRADE_I03,TRADE_QL03,"The law establishes clear and harmonized rules on a wide variety of digital trade measures (including transparency and information requirements for online service providers, commercial communications, electronic contracts and limitations of liability of intermediary service providers)",YES,YES,NO,NO,YES,YES,YES,YES
TRADE_I03,TRADE_QL03,"The law has been subject to stakeholder consultations, including the private sector. ",YES,YES,NO,NO,YES,YES,YES,YES
TRADE_I03,TRADE_QL03,"The government collects data on digital trade, although to a limited extent. ",YES,NO,NO,NO,YES,YES,NO,YES
TRADE_I03,TRADE_QL03,National and sub-national institutions have a formal co-ordination mechanism in place to implement digital trade policy and programmes. ,NO,YES,NO,NO,YES,NO,YES,YES
TRADE_I03,TRADE_QL03,The public has the means to influence policy design and implementation. ,YES,YES,NO,YES,YES,YES,YES,YES
TRADE_I03,TRADE_QL03,The digital trade law is aligned with national policy documents governing digital aspects of the economy. ,YES,NO,NO,NO,YES,YES,YES,YES
TRADE_I03,TRADE_QL03,Programmes and policies relating to digital trade are fully funded from the government’s budget.   ,NO,NO,NO,NO,NO,NO,NO,NO
TRADE_I03,TRADE_QL03,Programmes and initiatives related to digital trade are evaluated from the angle of output effectiveness and efficiency. ,YES,NO,NO,NO,YES,YES,YES,YES
TRADE_I03,TRADE_QL03,Digital trade programmes are subject to regular monitoring and evaluation by independent agencies.   ,NO,NO,NO,NO,NO,NO,NO,NO
TRADE_I03,TRADE_QL03,Results of the monitoring and evaluation activities are taken into account in future policy design. ,YES,NO,NO,NO,YES,YES,YES,YES
TRADE_I03,TRADE_QL03,Sustainability objectives are integrated into digital trade policy.  ,YES,NO,NO,NO,NO,NO,NO,NO
TRADE_I04,TRADE_QL04,There are some digital trade facilitation measures in place. ,YES,YES,NOT_AVAILABLE,NOT_AVAILABLE,YES,YES,YES,YES
TRADE_I04,TRADE_QL04,The government does not impose restrictions on goods and services supporting access to digital networks. ,NO,YES,NOT_AVAILABLE,NOT_AVAILABLE,YES,NO,YES,YES
TRADE_I04,TRADE_QL04,There is an institutional co-ordination mechanism in place for national and sub-national agencies. ,YES,YES,NOT_AVAILABLE,NOT_AVAILABLE,YES,YES,YES,YES
TRADE_I04,TRADE_QL04,Issuing digital certificates to traders to conduct electronic transactions is centralised within the purview of one designated institution. ,NO,YES,NOT_AVAILABLE,NOT_AVAILABLE,YES,NO,YES,YES
TRADE_I04,TRADE_QL04,The government implemented several transit facilitation programmes. ,YES,YES,NOT_AVAILABLE,NOT_AVAILABLE,YES,YES,YES,YES
TRADE_I04,TRADE_QL04,There is an electronic queuing system in place to reduce time and cost of customs clearance. ,NO,YES,NOT_AVAILABLE,NOT_AVAILABLE,YES,NO,YES,YES
TRADE_I04,TRADE_QL04,Digital trade facilitation measures are assessed from the angle of effectiveness and impact. ,YES,NO,NOT_AVAILABLE,NOT_AVAILABLE,YES,YES,YES,NO
TRADE_I04,TRADE_QL04,Traders have access to up to date information on latest digital trade facilitation measures through a dedicated digital platform. ,YES,YES,NOT_AVAILABLE,NOT_AVAILABLE,YES,YES,YES,NO
TRADE_I04,TRADE_QL04,Digital trade facilitation measures are regularly monitored and evaluated. ,YES,NO,NOT_AVAILABLE,NOT_AVAILABLE,YES,YES,YES,NO
TRADE_I04,TRADE_QL04,Programmes implementing digital trade facilitation measures are evaluated by independent assessors. ,YES,NO,NOT_AVAILABLE,NOT_AVAILABLE,NO,YES,NO,NO
TRADE_I04,TRADE_QL04,Results from the evaluation translate into future policy and programme design. ,YES,NO,NOT_AVAILABLE,NOT_AVAILABLE,YES,YES,NO,NO
TRADE_I04,TRADE_QL04,The government implemented programmes and policies to reduce the environmental impact of digital trade. ,YES,YES,NOT_AVAILABLE,NOT_AVAILABLE,NO,YES,NO,NO
TRADE_I05,TRADE_QL05,The relevant Ministry or government body is responsible for export promotion in the economy. ,YES,YES,NOT_AVAILABLE,NOT_AVAILABLE,YES,YES,YES,YES
TRADE_I05,TRADE_QL05,"There is an established Export Promotion Agency.
",YES,YES,NOT_AVAILABLE,NOT_AVAILABLE,YES,NO,YES,YES
TRADE_I05,TRADE_QL05,There is an informal co-ordination mechanism with relevant trade-support institutions. ,YES,YES,NOT_AVAILABLE,NOT_AVAILABLE,YES,YES,YES,YES
TRADE_I05,TRADE_QL05,The export promotion agency is fully operational. ,YES,YES,NOT_AVAILABLE,NOT_AVAILABLE,YES,YES,YES,YES
TRADE_I05,TRADE_QL05,The export promotion agency keeps a record of achieved targets and milestones.  ,YES,YES,NOT_AVAILABLE,NOT_AVAILABLE,YES,YES,YES,NO
TRADE_I05,TRADE_QL05,SMEs which are established exporters benefit from targeted technical assistance.  ,NO,YES,NOT_AVAILABLE,NOT_AVAILABLE,YES,YES,YES,YES
TRADE_I05,TRADE_QL05,There is a formal co-ordination mechanism with relevant trade-support institutions.,YES,YES,NOT_AVAILABLE,NOT_AVAILABLE,YES,NO,YES,YES
TRADE_I05,TRADE_QL05,"The export promotion agency is actively targeting larger firms, which have not started exporting yet. ",NO,YES,NOT_AVAILABLE,NOT_AVAILABLE,NO,NO,NO,YES
TRADE_I05,TRADE_QL05,The export promotion agency has operational autonomy. ,YES,YES,NOT_AVAILABLE,NOT_AVAILABLE,YES,NO,YES,YES
TRADE_I05,TRADE_QL05,The entire territory of the economy is covered under the export promotion agency’s work programme. ,YES,YES,NOT_AVAILABLE,NOT_AVAILABLE,YES,YES,YES,YES
TRADE_I05,TRADE_QL05,The export promotion agency is regularly monitored. ,YES,YES,NOT_AVAILABLE,NOT_AVAILABLE,YES,YES,YES,YES
TRADE_I05,TRADE_QL05,Support for environmental initiatives is actively offered by the export promotion agency.,NO,YES,NOT_AVAILABLE,NOT_AVAILABLE,NO,YES,NO,NO
TRADE_I05,TRADE_QL05,Priority is given to companies offering sustainable and environmentally-friendly goods and services. ,NO,NO,NOT_AVAILABLE,NOT_AVAILABLE,NO,NO,NO,NO
TRADE_I06,TRADE_QL06,Small scale export promotion programmes have been implemented.,YES,YES,YES,YES,YES,YES,YES,YES
TRADE_I06,TRADE_QL06,Potential beneficiaries are aware and informed about available export promotion programmes. ,YES,YES,YES,YES,YES,YES,YES,YES
TRADE_I06,TRADE_QL06,The government funds the majority of export promotion programmes. ,NO,NO,YES,NO,YES,NO,YES,YES
TRADE_I06,TRADE_QL06,Export promotion programmes are varied in scope.  ,NO,YES,YES,NO,YES,NO,YES,YES
TRADE_I06,TRADE_QL06,Companies are offered financial support to export their goods and services. ,NO,YES,NO,YES,YES,YES,NO,YES
TRADE_I06,TRADE_QL06,There is a co-ordination mechanism between different programmes. ,NO,NO,YES,NO,NO,NO,YES,NO
TRADE_I06,TRADE_QL06,The beneficiaries only partially pay for the services of the export promotion agency and programme participation. ,NO,YES,YES,NO,NO,NO,NO,YES
TRADE_I06,TRADE_QL06,Companies from the entire economy are eligible to benefit from export promotion programmes. ,YES,YES,NO,NO,YES,YES,YES,YES
TRADE_I06,TRADE_QL06,The government supports exporters in conforming to international standards in Export markets. ,YES,YES,NO,YES,NO,YES,YES,YES
TRADE_I06,TRADE_QL06,Export promotion programmes are subject to an independent review. ,NO,YES,YES,YES,NO,NO,NO,NO
TRADE_I06,TRADE_QL06,Financial support within the context of export promotion programmes is monitored through a dedicated mechanism. ,YES,YES,YES,YES,YES,YES,YES,YES
